{
  "frameSize": {
    "width": 627,
    "height": 627
  },
  "anchor": {
    "x": 0.5,
    "y": 1.0
  },
  "sheets": {
    "idle": "sprites/idle.png",
    "happy": "sprites/happy.png",
    "curious": "sprites/curious.png",
    "sleep": "sprites/sleep.png"
  },
  "clips": {
    "idle": {
      "sheet": "idle",
      "frames": [0, 1, 2, 3, 4, 5, 6, 7, 8, 9, 10, 11, 12, 13, 14, 15, 16, 17, 18, 19, 20, 21, 22, 23, 24, 25, 26, 27, 28, 29, 30, 31, 32, 33, 34, 35, 36, 37, 38, 39, 40, 41, 42, 43, 44, 45, 46, 47, 48, 49, 50, 51, 52, 53, 54, 55, 56, 57, 58, 59],
      "fps": 12,
      "loop": true
    },
    "happy": {
      "sheet": "happy",
      "frames": [0, 1, 2, 3, 4, 5, 6, 7, 8, 9, 10, 10, 11, 12, 13, 14, 15, 16, 17],
      "fps": 18,
      "loop": false
    },
    "curious": {
      "sheet": "curious",
      "frames": [0, 1, 2, 3, 4, 5, 6, 7, 8, 9, 10, 11, 11, 12, 13, 14, 15, 16, 17],
      "fps": 18,
      "loop": false
    },
    "sleep": {
      "sheet": "sleep",
      "frames": [0, 1, 2, 3, 4, 5, 6, 7],
      "fps": 6,
      "loop": true
    }
  },
  "interactions": {
    "tap": "happy"
  }
}
